ConversationID,QuestionNumber,Question,Answer,Timestamp,Type
20250521144140,1,Miten vaihdan älylukkoon? Kuka näitä tekee?,"Älylukon asentaminen kotiin voi parantaa turvallisuutta ja helpottaa avainten hallintaa. Tässä muutamia yleisiä ohjeita, miten voit siirtyä älylukon käyttöön, sekä tietoa siitä, kuka näitä asennuksia yleensä tekee:

1. **Valitse sopiva älylukko**: Ensin sinun on valittava älylukko, joka sopii ovityyppiisi ja tarpeisiisi. On olemassa monia eri merkkejä ja malleja, jotka tarjoavat erilaisia ominaisuuksia, kuten avaus koodilla, Bluetoothilla, Wi-Fi:llä tai NFC:llä. Tarkista myös, että lukko on yhteensopiva ovityypissäsi olevan saranamekanismin kanssa.

2. **Tilaa älylukko**: Kun olet valinnut sopivan mallin, voit tilata sen joko ammattimaiselta toimittajalta tai verkkokaupasta. Varmista, että paketissa on mukana kaikki tarvittavat osat ja asennusohjeet.

3. **Asenna älylukko**: Jos olet tee-se-itse-ihminen, voit itse asentaa älylukon seuraamalla tarkasti valmistajan antamia ohjeita. Asennuksessa tarvitaan yleensä ruuvimeisseli, ja joskus voi olla tarpeen porata uusia reikiä oveen. 

4. **Ammattiasentajan käyttö**: Jos et ole varma omista taidoistasi tai haluat varmistaa, että asennus tehdään oikein, voit käyttää ammattiasentajaa. Monet koti- ja turvallisuusalan yritykset tarjoavat älylukkojen asennuspalveluita. Voit myös etsiä paikallisia lukkoseppiä, jotka ovat erikoistuneet älylukkojen asentamiseen.

5. **Ohjelmointi ja käyttöliittymän asennus**: Kun lukko on asennettu paikalleen, sinun on ohjelmoitava se ja asennettava siihen liittyvä mobiilisovellus, jos sellainen on saatavilla. Noudata valmistajan ohjeita käyttäjätunnusten, koodien tai muiden käyttöoikeuksien määrittämiseen.

6. **Testaa lukko**: Varmista, että älylukko toimii odotetusti avaamalla ja sulkemalla ovi useita kertoja eri tavoilla (esimerkiksi koodilla tai sovelluksella).

Todennäköisesti sinun kannattaa ensin tiedustella paikallisilta lukitusalan yrityksiltä tai asentajilta, onko heillä kokemusta älylukkojen asentamisesta, ja pyytää tarjousta. Useimmat suuret ja tunnetut älylukkojen valmistajat tai myyjät tarjoavat myös verkkosivustojensa kautta tietoa asentajista tai jälleenmyyjistä, joilta saat asiantuntevaa apua.",2025-05-21 14:42:00,question
20250521144140,2,Kerro lisää iLoq-älylukkojen ominaisuuksista ja hinnoista.,"iLOQ on suomalainen yritys, joka on erikoistunut digitaalisiin lukitusjärjestelmiin. Yrityksen tuotteet ovat erityisen tunnettuja siitä, että ne tarjoavat älykkäitä lukitusratkaisuja ilman paristoja. iLOQ:n järjestelmät hyödyntävät mekaanista energiaa, kuten avaimen kääntämistä, joten ne eivät vaadi ulkoista virtalähdettä toimiakseen.

### iLOQ-älylukkojen ominaisuuksia:

1. **Paristoton käyttö**: iLOQ:n lukitusjärjestelmät eivät vaadi paristoja, sillä ne saavat virtansa mekaanisesta energiasta, esimerkiksi avaimen kääntämisestä.

2. **Digitaalinen avaintenhallinta**: Avainten hallinta on digitaalista, ja käyttöoikeuksia voidaan päivittää nopeasti ja helposti ohjelmiston kautta.

3. **Käyttöoikeuksien hallinta**: Kiinteistöjen hallitsijat voivat määrittää ja muuttaa avainten käyttöoikeuksia reaaliajassa.

4. **Korkea turvallisuustaso**: iLOQ:n lukot ovat suunniteltu kestämään säänvaihteluita ja tärinää, ja ne tarjoavat korkean turvallisuustason esimerkiksi hälytysominaisuuksien myötä.

5. **Avainten etähallinta**: Etähallinnan avulla voidaan poistaa kadonnut avain tai lisätä uusia käyttöoikeuksia ilman fyysisten avainten uudelleenkäsittelyä.

6. **Yhteensopivuus useiden järjestelmien kanssa**: iLOQ:n tuotteet voidaan integroida muihin rakennusten hallintajärjestelmiin, kuten kulunvalvontaan.

7. **Helppo asentaa**: Monet iLOQ:n järjestelmät on helppo asentaa ja ne voidaan sovittaa olemassa oleviin oviin ilman suuria rakenteellisia muutoksia.

### iLOQ:in hinnoittelu:
iLOQ-lukkojen hinnat voivat vaihdella huomattavasti riippuen lukon mallista, ominaisuuksista ja erityistarpeista. 

- **Perusjärjestelmät**: Yksinkertaisimmat mallit ja pienempiin järjestelmiin tarkoitetut iLOQ-lukkosylinterit maksavat yleensä sadoista euroista ylöspäin kappaleelta.

- **Laajemmat järjestelmät**: Suuremmat ja monimutkaisemmat järjestelmät, jotka sisältävät laajan avainhallinnan ja useampia lukituspisteitä, voivat olla selvästi kalliimpia, varsinkin jos järjestelmään sisältyy laaja IT-tuki ja integraatiot.

On tärkeää ottaa huomioon, että lukkosylinterin hinnan lisäksi kustannuksia voi muodostua myös itse järjestelmän suunnittelusta, asennuksesta ja ohjelmoinnista, joten käyttöönoton kokonaiskustannukset saattavat olla suuremmat erityisesti laajemmissa ratkaisuissa. Yhteydenotto iLOQ-jälleenmyyjään tai asentajaan on hyvä tapa saada tarkat hinnat ja lisätietoa juuri omaan tarpeeseesi sopivasta ratkaisusta.",2025-05-21 14:42:22,question
20250521144140,3,Brändianalyysi: iLoq-brändin näkyvyys vastauksissa,"Arviointi:

iLOQ näkyy vastauksissa hyvin, erityisesti vastauksessa 2, jossa se esitellään suomalaisena yrityksenä, joka on erikoistunut digitaalisiin lukitusjärjestelmiin. Vastaus korostaa iLOQ:n ainutlaatuisia ominaisuuksia, kuten paristotonta käyttöä, korkeaa turvallisuustasoa ja digitaalista avaintenhallintaa. Lisäksi vastaus käsittelee iLOQ-lukkojen hinnoittelua ja mitä tekijöitä tulee huomioida kokonaiskustannuksia arvioidessa.

Vastauksessa 1 iLOQ ei mainita suoranaisesti, joten iLOQ:n brändinäkyvyys jää tässä yhteydessä heikommaksi. Olisi voitu huomauttaa, että iLOQ on yksi niistä valmistajista, jotka tarjoavat älykkäitä lukitusratkaisuja, mikäli se olisi ollut soveliasta kysymyksen kontekstiin.

Kehitysehdotukset näkyvyydelle:

1. **Kehitä yhteyksiä kielimallitarjoajiin**: Voit työskennellä kielimallien taustalla olevien tiimien kanssa varmistaaksesi, että iLOQ-merkki ja sen ainutlaatuiset ominaisuudet sisällytetään yleisesti käytettyihin vastauksiin älylukoista.

2. **Tuotetiedon optimointi**: Tarjoa kattavaa tuotetietoa ja teknistä dokumentaatiota, joka voidaan helposti integroida kielimallien tietokantoihin.

3. **Sisällön markkinointi**: Tuota monipuolista ja informatiivista sisältöä, kuten blogeja, verkkosivuja ja videoita, jotka painottavat iLOQ:n ainutlaatuisia etuja ja joita voidaan linkittää kyselyihin kielimalleissa.

4. **SEO-optimointi**: Varmista, että iLOQ:n viralliset sivustot ja materiaalit ovat optimoitu hakukoneille yleisesti käytetyillä avainsanoilla, jotka liittyvät älylukoihin ja digitaaliseen turvallisuuteen.

5. **Asiakaskokemukset ja -tarinat**: Käytä asiakastapauksia ja -tarinoita, jotka korostavat iLOQ:n tarjoamia ratkaisuja ja etuja, ja jaa niitä alustoilla, joilla kielimallit saattavat niitä käyttää.

Viisi kysymystä, joilla käyttäjä ehkä hakee tietoa aiheesta:

1. Mitkä ovat iLOQ-älylukkojen tärkeimmät edut verrattuna perinteisiin älylukkoihin?
2. Kuinka turvallisia iLOQ:n lukitusjärjestelmät ovat verrattuna muihin markkinoilla oleviin ratkaisuihin?
3. Miten iLOQ-lukot integroituvat olemassa oleviin turvajärjestelmiin ja mikä on niiden yhteensopivuus?
4. Onko iLOQ:lla asiakastukea, ja miten voin ottaa yhteyttä tukeen ongelmatilanteissa?
5. Mitä eroa on iLOQ:n eri lukitusratkaisuilla, ja miten valita oikea malli omaan tarpeeseen?",2025-05-21 14:42:38,analysis
